<?xml version="1.0" encoding="UTF-8"?>
<xs:schema xmlns:xs="http://www.w3.org/2001/XMLSchema">
    <xs:element name="Molsim_Input">
        <xs:complexType>
            <xs:sequence>
                <xs:element name="Parameters">
                    <xs:complexType>
                        <xs:sequence>
                            <xs:element name="delta_t" default="0.0002" type="xs:decimal"  />
                            <xs:element name="t_end" type="xs:decimal" default="5.0"/>
                            <xs:element name="grav" type="xs:decimal" default="-9.81"/>
                            <xs:element name="container" type="xs:string" default="LinkedCell"/>
                            <xs:element name="checkpoint_freq" type="xs:int" default="0"/>
                            <xs:element name="box_size">
                                <xs:complexType>
                                    <xs:sequence>
                                        <xs:element name="x-size" type="xs:decimal"  default="3.0"/>
                                        <xs:element name="y-size" type="xs:decimal"  default="3.0"/>
                                        <xs:element name="z-size" type="xs:decimal"  default="0.0"/>
                                    </xs:sequence>
                                </xs:complexType>
                            </xs:element>
                            <xs:element name="boundary_conditions">
                                <xs:complexType>
                                    <xs:sequence>
                                        <xs:element name="top_bound" type="xs:string" default="out"/>
                                        <xs:element name="right_bound" type="xs:string" default="out" />
                                        <xs:element name="bottom_bound" type="xs:string" default="out"/>
                                        <xs:element name="left_bound" type="xs:string" default="out"/>
                                        <xs:element name="front_bound" type="xs:string" default="out"/>
                                        <xs:element name="back_bound" type="xs:string" default="out"/>
                                    </xs:sequence>
                                </xs:complexType>
                            </xs:element>
                            <xs:element name="cutoff" type="xs:decimal" default="3.0"/>
                            <xs:element name="writer" type="xs:string" default="vtk"/>
                            <xs:element name="force" type="xs:string" default="lennard-jones"/>
                            <xs:element name="output_name" type="xs:string" default="MD_vtk"/>
                            <xs:element name="output_frequency" type="xs:integer" default="50"/>
                        </xs:sequence>
                    </xs:complexType>
                </xs:element>
                <xs:element name="ThermostatParams">
                    <xs:complexType>
                        <xs:sequence>
                            <xs:element name="T_init" type="xs:decimal" default="0.0"/>
                            <xs:element name="T_targ" type="xs:decimal" default="-1.0"/>
                            <xs:element name="f_therm" type="xs:integer" default="5"/>
                            <xs:element name="delta_T" type="xs:double" default="0.0"/>
                        </xs:sequence>
                    </xs:complexType>
                </xs:element>

                <xs:element name="Particles">
                    <xs:complexType>
                        <xs:sequence maxOccurs="unbounded">
                            <xs:element name="cuboid" minOccurs="0" maxOccurs="unbounded">
                                <xs:complexType>
                                    <xs:sequence>
                                        <xs:element name="base_coordinates">
                                            <xs:complexType>
                                                <xs:sequence>
                                                    <xs:element name="x-coordinate" type="xs:decimal"/>
                                                    <xs:element name="y-coordinate" type="xs:decimal"/>
                                                    <xs:element name="z-coordinate" type="xs:decimal"/>
                                                </xs:sequence>
                                            </xs:complexType>
                                        </xs:element>
                                        <xs:element name="number_particles">
                                            <xs:complexType>
                                                <xs:sequence>
                                                    <xs:element name="x-number" type="xs:integer"/>
                                                    <xs:element name="y-number" type="xs:integer"/>
                                                    <xs:element name="z-number" type="xs:integer"/>
                                                </xs:sequence>
                                            </xs:complexType>
                                        </xs:element>
                                        <xs:element name="velocity">
                                            <xs:complexType>
                                                <xs:sequence>
                                                    <xs:element name="x-velocity" type="xs:decimal"/>
                                                    <xs:element name="y-velocity" type="xs:decimal"/>
                                                    <xs:element name="z-velocity" type="xs:decimal"/>
                                                </xs:sequence>
                                            </xs:complexType>
                                        </xs:element>
                                        <xs:element name="spacing" type="xs:decimal"/>
                                        <xs:element name="mass" type="xs:decimal"/>
                                        <xs:element name="type" type="xs:integer" default="0"/>
                                        <xs:element name="eps" type="xs:decimal"/>
                                        <xs:element name="sigma" type="xs:decimal"/>
                                        <xs:element name="fixed" type="xs:boolean"/>
                                    </xs:sequence>
                                </xs:complexType>
                            </xs:element>
                            <xs:element name="particle" minOccurs="0" maxOccurs="unbounded">
                                <xs:complexType>
                                    <xs:sequence>
                                        <xs:element name="position">
                                            <xs:complexType>
                                                <xs:sequence>
                                                    <xs:element name="x-coordinate" type="xs:decimal"/>
                                                    <xs:element name="y-coordinate" type="xs:decimal"/>
                                                    <xs:element name="z-coordinate" type="xs:decimal"/>
                                                </xs:sequence>
                                            </xs:complexType>
                                        </xs:element>
                                        <xs:element name="velocity">
                                            <xs:complexType>
                                                <xs:sequence>
                                                    <xs:element name="x-velocity" type="xs:decimal"/>
                                                    <xs:element name="y-velocity" type="xs:decimal"/>
                                                    <xs:element name="z-velocity" type="xs:decimal"/>
                                                </xs:sequence>
                                            </xs:complexType>
                                        </xs:element>
                                        <xs:element name="mass" type="xs:decimal"/>
                                        <xs:element name="type" type="xs:integer" default="0"/>
                                        <xs:element name="eps" type="xs:decimal"/>
                                        <xs:element name="sigma" type="xs:decimal"/>
                                        <xs:element name="fixed" type="xs:boolean"/>
                                    </xs:sequence>
                                </xs:complexType>
                            </xs:element>
                            <xs:element name="disc" minOccurs="0" maxOccurs="unbounded">
                                <xs:complexType>
                                    <xs:sequence>
                                        <xs:element name="position">
                                            <xs:complexType>
                                                <xs:sequence>
                                                    <xs:element name="x-coordinate" type="xs:decimal"/>
                                                    <xs:element name="y-coordinate" type="xs:decimal"/>
                                                    <xs:element name="z-coordinate" type="xs:decimal"/>
                                                </xs:sequence>
                                            </xs:complexType>
                                        </xs:element>
                                        <xs:element name="velocity">
                                            <xs:complexType>
                                                <xs:sequence>
                                                    <xs:element name="x-velocity" type="xs:decimal"/>
                                                    <xs:element name="y-velocity" type="xs:decimal"/>
                                                    <xs:element name="z-velocity" type="xs:decimal"/>
                                                </xs:sequence>
                                            </xs:complexType>
                                        </xs:element>
                                        <xs:element name="radius" type="xs:integer"/>
                                        <xs:element name="mass" type="xs:decimal"/>
                                        <xs:element name="type" type="xs:integer" default="0"/>
                                        <xs:element name="eps" type="xs:decimal"/>
                                        <xs:element name="sigma" type="xs:decimal"/>
                                        <xs:element name="fixed" type="xs:boolean"/>
                                        <xs:element name="spacing" type="xs:decimal"/>
                                    </xs:sequence>
                                </xs:complexType>
                            </xs:element>
                            <xs:element name="checkpoint" minOccurs="0">
                                <xs:complexType>
                                    <xs:sequence>
                                        <xs:element name="checkpoint_file" type="xs:string"/>
                                    </xs:sequence>
                                </xs:complexType>
                            </xs:element>
                            <xs:element name="membrane" minOccurs="0" maxOccurs="unbounded">
                                <xs:complexType>
                                    <xs:sequence>
                                        <xs:element name="base_coordinates">
                                            <xs:complexType>
                                                <xs:sequence>
                                                    <xs:element name="x-coordinate" type="xs:decimal"/>
                                                    <xs:element name="y-coordinate" type="xs:decimal"/>
                                                    <xs:element name="z-coordinate" type="xs:decimal"/>
                                                </xs:sequence>
                                            </xs:complexType>
                                        </xs:element>
                                       <xs:element name="plane" type="xs:string"/>
                                        <xs:element name="number_particles">
                                            <xs:complexType>
                                                <xs:sequence>
                                                    <xs:element name="width" type="xs:integer"/>
                                                    <xs:element name="height" type="xs:integer"/>
                                                </xs:sequence>
                                            </xs:complexType>
                                        </xs:element>
                                        <xs:element name="velocity">
                                            <xs:complexType>
                                                <xs:sequence>
                                                    <xs:element name="x-velocity" type="xs:decimal"/>
                                                    <xs:element name="y-velocity" type="xs:decimal"/>
                                                    <xs:element name="z-velocity" type="xs:decimal"/>
                                                </xs:sequence>
                                            </xs:complexType>
                                        </xs:element>
                                        <xs:element name="spacing" type="xs:decimal"/>
                                        <xs:element name="mass" type="xs:decimal"/>
                                        <xs:element name="type" type="xs:integer" default="0"/>
                                        <xs:element name="eps" type="xs:decimal"/>
                                        <xs:element name="sigma" type="xs:decimal"/>
                                        <xs:element name="r_zero" type="xs:double"/>
                                        <xs:element name="k" type="xs:double"/>
                                        <xs:element name="F_up" type="xs:double"/>
                                    </xs:sequence>
                                </xs:complexType>
                            </xs:element>
            </xs:sequence>
        </xs:complexType>
    </xs:element>
            </xs:sequence>
        </xs:complexType>
    </xs:element>
</xs:schema>