<?xml version="1.0" encoding="UTF-8"?>

<Molsim_Input xmlns:xsi="http://www.w3.org/2001/XMLSchema-instance"
              xsi:noNamespaceSchemaLocation="input.xsd">
    <Parameters>
        <delta_t>0.0005</delta_t>
        <t_end>0.5</t_end>
        <grav>-12.44</grav>
        <container>LinkedCell</container>
        <checkpoint_freq/>
        <box_size>
            <x-size>300</x-size>
            <y-size>54</y-size>
            <z-size>0</z-size>
        </box_size>
        <boundary_conditions>
            <top_bound>ref</top_bound>
            <right_bound>per</right_bound>
            <bottom_bound>ref</bottom_bound>
            <left_bound>per</left_bound>
            <front_bound>ref</front_bound>
            <back_bound>ref</back_bound>
        </boundary_conditions>
        <cutoff>3.0</cutoff>
        <writer/>
        <force/>
        <output_name>benchy</output_name>
        <output_frequency>2000</output_frequency>
    </Parameters>
    <ThermostatParams>
        <T_init>40</T_init>
        <T_targ>40</T_targ>
        <f_therm>1000</f_therm>
        <delta_T>INF</delta_T>
    </ThermostatParams>
    <Particles>
        <cuboid>
            <base_coordinates>
                <x-coordinate>0.6</x-coordinate>
                <y-coordinate>2.0</y-coordinate>
                <z-coordinate>0.0</z-coordinate>
            </base_coordinates>
            <number_particles>
                <x-number>250</x-number>
                <y-number>20</y-number>
                <z-number>1</z-number>
            </number_particles>
            <velocity>
                <x-velocity>0.0</x-velocity>
                <y-velocity>0.0</y-velocity>
                <z-velocity>0.0</z-velocity>
            </velocity>
            <spacing>1.2</spacing>
            <mass>1.0</mass>
            <type>0</type>
            <eps>1.0</eps>
            <sigma>1.2</sigma>
        </cuboid>
        <cuboid>
            <base_coordinates>
                <x-coordinate>0.6</x-coordinate>
                <y-coordinate>27</y-coordinate>
                <z-coordinate>0</z-coordinate>
            </base_coordinates>
            <number_particles>
                <x-number>250</x-number>
                <y-number>20</y-number>
                <z-number>1</z-number>
            </number_particles>
            <velocity>
                <x-velocity>0.0</x-velocity>
                <y-velocity>0.0</y-velocity>
                <z-velocity>0.0</z-velocity>
            </velocity>
            <spacing>1.2</spacing>
            <mass>2.0</mass>
            <type>1</type>
            <eps>1.0</eps>
            <sigma>1.1</sigma>
        </cuboid>
    </Particles>
</Molsim_Input>