<?xml version="1.0" encoding="UTF-8"?>

<Molsim_Input xmlns:xsi="http://www.w3.org/2001/XMLSchema-instance"
              xsi:noNamespaceSchemaLocation="input.xsd">
    <Parameters>
        <delta_t>0.0005</delta_t>
        <t_end>500</t_end>
        <Grav>
            <x-grav>0</x-grav>
            <y-grav>-0.8</y-grav>
            <z-grav>0.0</z-grav>
        </Grav>
        <container>LinkedCell</container>
        <checkpoint_freq>0</checkpoint_freq>
        <box_size>
            <x-size>30</x-size>
            <y-size>30</y-size>
            <z-size>12</z-size>
        </box_size>
        <boundary_conditions>
            <top_bound>per</top_bound>
            <right_bound>out</right_bound>
            <bottom_bound>per</bottom_bound>
            <left_bound>out</left_bound>
            <front_bound>per</front_bound>
            <back_bound>per</back_bound>
        </boundary_conditions>
        <cutoff>2.75</cutoff>
        <writer/>
        <force/>
        <output_name>NanoFlow</output_name>
        <output_frequency>50</output_frequency>
        <statistics_freq>10000</statistics_freq>
    </Parameters>
    <ThermostatParams>
        <T_init>40</T_init>
        <T_targ>40</T_targ>
        <f_therm>10</f_therm>
        <delta_T>INF</delta_T>
    </ThermostatParams>
    <Particles>
        <cuboid>
            <base_coordinates>
                <x-coordinate>1.0</x-coordinate>
                <y-coordinate>0.5</y-coordinate>
                <z-coordinate>0.5</z-coordinate>
            </base_coordinates>
            <number_particles>
                <x-number>2</x-number>
                <y-number>30</y-number>
                <z-number>12</z-number>
            </number_particles>
            <velocity>
                <x-velocity>0</x-velocity>
                <y-velocity>0</y-velocity>
                <z-velocity>0</z-velocity>
            </velocity>
            <spacing>1.0</spacing>
            <mass>1.0</mass>
            <type>0</type>
            <eps>2.0</eps>
            <sigma>1.1</sigma>
            <fixed>true</fixed>
        </cuboid>
        <cuboid>
            <base_coordinates>
                <x-coordinate>27.2</x-coordinate>
                <y-coordinate>0.5</y-coordinate>
                <z-coordinate>0.5</z-coordinate>
            </base_coordinates>
            <number_particles>
                <x-number>2</x-number>
                <y-number>30</y-number>
                <z-number>12</z-number>
            </number_particles>
            <velocity>
                <x-velocity>0</x-velocity>
                <y-velocity>0</y-velocity>
                <z-velocity>0</z-velocity>
            </velocity>
            <spacing>1.0</spacing>
            <mass>1.0</mass>
            <type>0</type>
            <eps>2.0</eps>
            <sigma>1.1</sigma>
            <fixed>true</fixed>
        </cuboid>
        <cuboid>
            <base_coordinates>
                <x-coordinate>3.2</x-coordinate>
                <y-coordinate>0.6</y-coordinate>
                <z-coordinate>0.6</z-coordinate>
            </base_coordinates>
            <number_particles>
                <x-number>20</x-number>
                <y-number>25</y-number>
                <z-number>10</z-number>
            </number_particles>
            <velocity>
                <x-velocity>0</x-velocity>
                <y-velocity>0</y-velocity>
                <z-velocity>0</z-velocity>
            </velocity>
            <spacing>1.2</spacing>
            <mass>1.0</mass>
            <type>1</type>
            <eps>1.0</eps>
            <sigma>1.0</sigma>
            <fixed>false</fixed>
        </cuboid>
    </Particles>
</Molsim_Input>