<?xml version="1.0" encoding="UTF-8"?>

<Molsim_Input xmlns:xsi="http://www.w3.org/2001/XMLSchema-instance"
              xsi:noNamespaceSchemaLocation="../../input/input.xsd">
    <Parameters>
        <delta_t>0.002</delta_t>
        <t_end> 1.0 </t_end>
        <grav>0</grav>
        <container>Basic</container>
        <checkpoint_freq>0</checkpoint_freq>
        <box_size>
            <x-size/>
            <y-size/>
            <z-size/>
        </box_size>
        <boundary_conditions>
            <top_bound/>
            <right_bound/>
            <bottom_bound/>
            <left_bound/>
            <front_bound/>
            <back_bound/>
        </boundary_conditions>
        <cutoff/>
        <writer/>
        <force/>
        <output_name/>
        <output_frequency/>
        <statistics_freq>0</statistics_freq>
    </Parameters>
    <ThermostatParams>
        <T_init>0</T_init>
        <T_targ>0</T_targ>
        <f_therm>0</f_therm>
        <delta_T>0</delta_T>
    </ThermostatParams>
    <Particles>
        <cuboid>
            <base_coordinates>
                <x-coordinate>0.0</x-coordinate>
                <y-coordinate>0.0</y-coordinate>
                <z-coordinate>0.0</z-coordinate>
            </base_coordinates>
            <number_particles>
                <x-number>2</x-number>
                <y-number>2</y-number>
                <z-number>2</z-number>
            </number_particles>
            <velocity>
                <x-velocity>0.0</x-velocity>
                <y-velocity>0.0</y-velocity>
                <z-velocity>0.0</z-velocity>
            </velocity>
            <spacing>1.0</spacing>
            <mass>1.0</mass>
            <type>0</type>
            <eps>5</eps>
            <sigma>1</sigma>
            <fixed>false</fixed>
        </cuboid>
        <cuboid>
            <base_coordinates>
                <x-coordinate>0.5</x-coordinate>
                <y-coordinate>0.5</y-coordinate>
                <z-coordinate>0.5</z-coordinate>
            </base_coordinates>
            <number_particles>
                <x-number>2</x-number>
                <y-number>2</y-number>
                <z-number>1</z-number>
            </number_particles>
            <velocity>
                <x-velocity>0.0</x-velocity>
                <y-velocity>0.0</y-velocity>
                <z-velocity>0.0</z-velocity>
            </velocity>
            <spacing>1.0</spacing>
            <mass>2.0</mass>
            <type>1</type>
            <eps>5</eps>
            <sigma>1</sigma>
            <fixed>false</fixed>
        </cuboid>
        <particle>
            <position>
                <x-coordinate>0.0</x-coordinate>
                <y-coordinate>5.0</y-coordinate>
                <z-coordinate>0.0</z-coordinate>
            </position>
            <velocity>
                <x-velocity>0.0</x-velocity>
                <y-velocity>-1.0</y-velocity>
                <z-velocity>0.0</z-velocity>
            </velocity>
            <mass>1.0</mass>
            <type>0</type>
            <eps>5</eps>
            <sigma>1</sigma>
            <fixed>false</fixed>
        </particle>
        <particle>
            <position>
                <x-coordinate>2.0</x-coordinate>
                <y-coordinate>1.0</y-coordinate>
                <z-coordinate>0.0</z-coordinate>
            </position>
            <velocity>
                <x-velocity>0.0</x-velocity>
                <y-velocity>0.0</y-velocity>
                <z-velocity>0.0</z-velocity>
            </velocity>
            <mass>1.0</mass>
            <type>0</type>
            <eps>5</eps>
            <sigma>1</sigma>
            <fixed>false</fixed>
        </particle>
    </Particles>
</Molsim_Input>