<?xml version="1.0" encoding="UTF-8"?>

<Molsim_Input xmlns:xsi="http://www.w3.org/2001/XMLSchema-instance"
              xsi:noNamespaceSchemaLocation="input.xsd">
    <Parameters>
        <delta_t>0.0002</delta_t>
        <t_end>2.0</t_end>
        <writer/>
        <force/>
        <output_name>tb_vtk</output_name>
        <output_frequency/>
    </Parameters>
    <Particles>
        <cuboid>
            <base_coordinates>
                <x-coordinate>0.0</x-coordinate>
                <y-coordinate>0.0</y-coordinate>
                <z-coordinate>0.0</z-coordinate>
            </base_coordinates>
            <number_particles>
                <x-number>40</x-number>
                <y-number>8</y-number>
                <z-number>1</z-number>
            </number_particles>
            <velocity>
                <x-velocity>0.0</x-velocity>
                <y-velocity>0.0</y-velocity>
                <z-velocity>0.0</z-velocity>
            </velocity>
            <spacing>1.1225</spacing>
            <mass>1.0</mass>
            <brownian_vel>0.1</brownian_vel>
        </cuboid>
        <cuboid>
            <base_coordinates>
                <x-coordinate>15.0</x-coordinate>
                <y-coordinate>15.0</y-coordinate>
                <z-coordinate>0.0</z-coordinate>
            </base_coordinates>
            <number_particles>
                <x-number>8</x-number>
                <y-number>8</y-number>
                <z-number>1</z-number>
            </number_particles>
            <velocity>
                <x-velocity>0.0</x-velocity>
                <y-velocity>-10.0</y-velocity>
                <z-velocity>0.0</z-velocity>
            </velocity>
            <spacing>1.1225</spacing>
            <mass>1.0</mass>
            <brownian_vel>0.1</brownian_vel>
        </cuboid>
    </Particles>
</Molsim_Input>